{
  "id": "prod_biquiniv",
  "slug": "biquini-vermelho-intense",
  "nome": "Biquíni Vermelho Intense",
  "seoTitulo": "Biquíni Vermelho Intense: Cortininha | Turkista",
  "seoDescricao": "Biquíni Vermelho Intense cortininha, com top triangular franzido e amarrações no pescoço e nas costas. Calcinha ajustável. Tamanho M, R$ 80.",
  "linha": "praia",
  "categoria": "Biquíni ",
  "descricaoCurta": "Biquíni vermelho cortininha com top triangular franzido, amarrações ajustáveis no pescoço e nas costas e calcinha com laterais de amarrar.",
  "descricaoCompleta": "Biquíni vermelho de modelagem cortininha, com visual clássico e marcante. O top possui formato triangular com franzidos que valorizam o design da peça e amarrações para ajuste no pescoço e nas costas. A calcinha possui laterais com tiras para amarração, permitindo regular a modelagem de acordo com sua preferência. Uma escolha atemporal para quem busca um biquíni elegante, feminino e cheio de personalidade.\r\n\r\nDetalhes:\r\n\r\nCor vermelha intensa\r\nTop cortininha com franzidos\r\nAmarração ajustável\r\nCalcinha com laterais de amarração\r\nModelagem versátil\r\nEstilo clássico e sofisticado",
  "composicao": {
    "tecido": "Poliamida (84% a 85%) e elastano (15% a 16%)",
    "protecaoUV": null,
    "paisDeFabricacao": "Brasil"
  },
  "cores": [
    {
      "nome": "vermelho",
      "hex": "#F279C8",
      "imagens": [
        {
          "arquivo": "biquini-vermelho-intense.webp",
          "alt": "Biquíni Vermelho Intense",
          "proporcao": "3:4"
        }
      ]
    }
  ],
  "tamanhos": [
    "M"
  ],
  "preco": {
    "valor": 80,
    "parcelamento": "2x sem juros"
  },
  "imagens": [
    {
      "arquivo": "biquini-vermelho-intense.webp",
      "alt": "Biquíni Vermelho Intense",
      "proporcao": "3:4"
    }
  ],
  "badges": [
    "ultimas-unidades"
  ],
  "tags": [
    "biquíni",
    "praia"
  ],
  "status": "publicado",
  "dataCriacao": "2026-08-15",
  "genero": "feminino",
  "faixaEtaria": "15+"
}
