{
  "id": "prod_conjuntodetreinoazulocen",
  "slug": "conjunto-de-treino-azul-ocen",
  "nome": "Conjunto de treino Azul Oceano",
  "linha": "turk-fit",
  "categoria": "Conjunto ",
  "descricaoCurta": "Conjunto fitness azul-marinho com top de decote alto e alças halter cruzadas na frente, combinado com legging de cintura alta e compressão para treinos.",
  "descricaoCompleta": "Conjunto azul-marinho liso, com top de decote alto e alças finas cruzadas na frente (estilo halter) e legging de cintura alta.\r\n\r\nO top possui excelente compressão, oferecendo sustentação e segurança durante os movimentos. A calça conta com modelagem que valoriza a silhueta, proporcionando firmeza, conforto e liberdade de movimento durante o treino.\r\n\r\nDestaques:\r\n\r\nCor azul-marinho;\r\nTop halter, com alças cruzadas na frente;\r\nLegging de cintura alta;\r\nCompressão e sustentação;\r\nIdeal para corrida, academia e treinos de alto impacto;",
  "composicao": {
    "tecido": "Poliamida (84% a 85%) e elastano (15% a 16%)",
    "protecaoUV": null,
    "paisDeFabricacao": "Brasil"
  },
  "cores": [
    {
      "nome": "Azul escuro",
      "hex": "#F279C8",
      "imagens": [
        {
          "arquivo": "conjunto-de-treino-azul-ocen.webp",
          "alt": "Conjunto de treino Azul Ocen",
          "proporcao": "3:4"
        }
      ]
    }
  ],
  "tamanhos": [
    "G"
  ],
  "preco": {
    "valor": 180,
    "parcelamento": "2 x sem juros"
  },
  "imagens": [
    {
      "arquivo": "conjunto-de-treino-azul-ocen.webp",
      "alt": "Conjunto de treino Azul Ocen",
      "proporcao": "3:4"
    }
  ],
  "badges": [
    "ultimas-unidades"
  ],
  "tags": [
    "academia",
    "treino"
  ],
  "status": "publicado",
  "dataCriacao": "2026-08-12",
  "genero": "feminino",
  "faixaEtaria": "15+",
  "seoDescricao": "Conjunto fitness Azul Oceano com top halter e legging de cintura alta para corrida, academia e treinos intensos. Tamanho G, por R$ 180."
}
