{
  "id": "prod_biquinivivencepartesuperior",
  "slug": "biquini-vivence-parte-superior",
  "nome": "Biquíni Vivence - parte superior",
  "linha": "praia",
  "categoria": "Biquíni parte superior",
  "descricaoCurta": "Top de biquíni Vivence preto com lantejoulas e reflexos dourados, bojo estruturado e amarração ajustável no pescoço. Fivela central não metálica.",
  "descricaoCompleta": "Top de biquíni revestido em lantejoulas, em tom preto com reflexos dourados e bronze. Bojo estruturado, com fivela central que imita metal — não é uma peça metálica.\r\n\r\nModelo halter, com amarração no pescoço e alças reguláveis, para ajustar a sustentação. Peça no tamanho GG, equivalente ao tamanho 58.\r\n\r\nDestaques:\r\n\r\nRevestimento total em lantejoulas preto e dourado;\r\nBojo estruturado, com fivela central não metálica;\r\nAmarração regulável no pescoço;\r\nTamanho GG (58);",
  "composicao": {
    "tecido": "Poliamida (84% a 85%) e elastano (15% a 16%)",
    "protecaoUV": null,
    "paisDeFabricacao": "Brasil"
  },
  "cores": [
    {
      "nome": "colorido com lantejoulas",
      "hex": "#F279C8",
      "imagens": [
        {
          "arquivo": "biquini-vivence-parte-superior.webp",
          "alt": "Biquíni Vivence - parte superior",
          "proporcao": "3:4"
        }
      ]
    }
  ],
  "tamanhos": [
    "GG"
  ],
  "preco": {
    "valor": 95,
    "parcelamento": "3x sem juros"
  },
  "imagens": [
    {
      "arquivo": "biquini-vivence-parte-superior.webp",
      "alt": "Biquíni Vivence - parte superior",
      "proporcao": "3:4"
    }
  ],
  "badges": [
    "exclusivo",
    "ultimas-unidades"
  ],
  "tags": [
    "biquíni",
    "praia",
    "sustentação"
  ],
  "status": "publicado",
  "dataCriacao": "2026-08-15",
  "genero": "feminino",
  "faixaEtaria": "15+",
  "seoDescricao": "Top de biquíni Vivence preto com lantejoulas douradas, bojo estruturado e amarração ajustável. Tamanho GG (58), por R$ 95 em 3x sem juros."
}
