{
  "id": "prod_conjuntodetreinoshortetopcintila",
  "slug": "conjunto-de-treino-short-e-top-cintila",
  "nome": "Conjunto de treino Short e Top Cintila",
  "linha": "turk-fit",
  "categoria": "Conjunto ",
  "descricaoCurta": "Conjunto fitness roxo cintilante com top nadador de alças largas e short de cós alto. Tecido liso com toque acetinado e compressão para treinos.",
  "descricaoCompleta": "Conjunto de short e top em roxo cintilante, com top nadador — alças largas e recorte cavado nas costas — e short de cós alto.\r\n\r\nPossui excelente compressão, proporcionando firmeza, sustentação e segurança mesmo durante treinos de alto impacto. Confeccionado em tecido liso, com toque acetinado.\r\n\r\nDestaques:\r\n\r\nCor roxo cintilante;\r\nTop nadador, com recorte cavado nas costas;\r\nShort de cós alto;\r\nAlta compressão;\r\nToque acetinado;",
  "composicao": {
    "tecido": "Poliamida (84% a 85%) e elastano (15% a 16%)",
    "protecaoUV": null,
    "paisDeFabricacao": "Brasil"
  },
  "cores": [
    {
      "nome": "Roxo cintilante",
      "hex": "#F279C8",
      "imagens": [
        {
          "arquivo": "conjunto-de-treino-short-e-top-cintila.webp",
          "alt": "Conjunto de treino Short e Top Cintila",
          "proporcao": "3:4"
        }
      ]
    }
  ],
  "tamanhos": [
    "M"
  ],
  "preco": {
    "valor": 140,
    "parcelamento": "2x sem juros = 70 reais"
  },
  "imagens": [
    {
      "arquivo": "conjunto-de-treino-short-e-top-cintila.webp",
      "alt": "Conjunto de treino Short e Top Cintila",
      "proporcao": "3:4"
    }
  ],
  "badges": [
    "ultimas-unidades"
  ],
  "tags": [
    "conjunto de academia",
    "short e top"
  ],
  "status": "publicado",
  "dataCriacao": "2026-08-12",
  "genero": "feminino",
  "faixaEtaria": "15+",
  "seoDescricao": "Conjunto fitness Cintila roxo com top nadador e short de cós alto, em tecido acetinado. Tamanho M, por R$ 140."
}
