{
  "id": "prod_biquinicortinhabicolorlaranjaeroxo",
  "slug": "biquini-cortininha-bicolor-laranja-e-roxo",
  "nome": "Biquíni Cortininha Bicolor — Laranja e Roxo",
  "linha": "praia",
  "categoria": "Biquíni parte superior",
  "descricaoCurta": "Top de biquíni cortininha bicolor em laranja e roxo, com modelagem triangular e amarrações ajustáveis no pescoço e nas costas. Venda da parte superior.",
  "descricaoCompleta": "Biquíni cortininha bicolor que combina laranja vibrante e roxo intenso em uma composição moderna e cheia de personalidade. O top possui modelagem triangular com regulagem por amarração no pescoço e nas costas, permitindo ajustar a peça ao corpo. \r\n\r\nDetalhes:\r\n\r\nTop modelo cortininha\r\nDuas cores contrastantes\r\nAmarração no pescoço e nas costas\r\nModelagem ajustável\r\nEstilo tropical e vibrante",
  "composicao": {
    "tecido": "Poliamida (84% a 85%) e elastano (15% a 16%)",
    "protecaoUV": null,
    "paisDeFabricacao": "Brasil"
  },
  "cores": [
    {
      "nome": "laranja e roxo",
      "hex": "#F279C8",
      "imagens": [
        {
          "arquivo": "biquini-cortininha-bicolor-laranja-e-roxo.webp",
          "alt": "Cortininha bicolor em laranja e roxo, com amarrações ajustáveis",
          "proporcao": "3:4"
        }
      ]
    }
  ],
  "tamanhos": [
    "P"
  ],
  "preco": {
    "valor": 40,
    "parcelamento": "2x sem juros"
  },
  "imagens": [
    {
      "arquivo": "biquini-cortininha-bicolor-laranja-e-roxo.webp",
      "alt": "Cortininha bicolor em laranja e roxo, com amarrações ajustáveis",
      "proporcao": "3:4"
    }
  ],
  "badges": [
    "ultimas-unidades"
  ],
  "tags": [
    "biquíni",
    "praia"
  ],
  "status": "publicado",
  "dataCriacao": "2026-08-15",
  "genero": "feminino",
  "faixaEtaria": "15+",
  "seoDescricao": "Top de biquíni cortininha laranja e roxo, com amarrações ajustáveis e proposta dupla face. Tamanho P, por R$ 40 em 2x sem juros.",
  "seoTitulo": "Top de Biquíni Cortininha Bicolor Laranja e Roxo | Turkista"
}
