{
  "id": "prod_xuxinhascoloridas",
  "slug": "xuxinhas-coloridas",
  "nome": "Xuxinhas coloridas",
  "linha": "turk-fit",
  "categoria": "acessório de cabelo",
  "descricaoCurta": "Xuxinhas coloridas feitas com retalhos de tecido da Turkista; as cores e estampas variam conforme os materiais disponíveis.",
  "descricaoCompleta": "Xuxinha feita com retalhos de tecido das peças da Turkista — a cor e a estampa variam conforme o que sobra da produção, então cada unidade sai praticamente única.\r\n\r\nMesmo tecido das roupas da marca, poliamida com elastano, mais resistente do que uma xuxinha comum de algodão.\r\n\r\nDestaques:\r\n\r\nFeita com retalhos das peças Turkista;\r\nCor e estampa variam conforme o estoque;\r\nMesmo tecido das roupas da marca;\r\nTamanho M;",
  "composicao": {
    "tecido": "Poliamida (84% a 85%) e elastano (15% a 16%)",
    "protecaoUV": null,
    "paisDeFabricacao": "Brasil"
  },
  "cores": [
    {
      "nome": "colorido",
      "hex": "#F279C8",
      "imagens": [
        {
          "arquivo": "xuxinhas-coloridas-1.webp",
          "alt": "Xuxinhas coloridas - foto 1",
          "proporcao": "3:4"
        },
        {
          "arquivo": "xuxinhas-coloridas-2.webp",
          "alt": "Xuxinhas coloridas - foto 2",
          "proporcao": "3:4"
        },
        {
          "arquivo": "xuxinhas-coloridas-3.webp",
          "alt": "Xuxinhas coloridas - foto 3",
          "proporcao": "3:4"
        },
        {
          "arquivo": "xuxinhas-coloridas-4.webp",
          "alt": "Xuxinhas coloridas - foto 4",
          "proporcao": "3:4"
        },
        {
          "arquivo": "xuxinhas-coloridas-5.webp",
          "alt": "Xuxinhas coloridas - foto 5",
          "proporcao": "3:4"
        },
        {
          "arquivo": "xuxinhas-coloridas-6.webp",
          "alt": "Xuxinhas coloridas - foto 6",
          "proporcao": "3:4"
        }
      ]
    }
  ],
  "tamanhos": [
    "M"
  ],
  "preco": {
    "valor": 10,
    "parcelamento": ""
  },
  "imagens": [
    {
      "arquivo": "xuxinhas-coloridas-1.webp",
      "alt": "Xuxinhas coloridas - foto 1",
      "proporcao": "3:4"
    },
    {
      "arquivo": "xuxinhas-coloridas-2.webp",
      "alt": "Xuxinhas coloridas - foto 2",
      "proporcao": "3:4"
    },
    {
      "arquivo": "xuxinhas-coloridas-3.webp",
      "alt": "Xuxinhas coloridas - foto 3",
      "proporcao": "3:4"
    },
    {
      "arquivo": "xuxinhas-coloridas-4.webp",
      "alt": "Xuxinhas coloridas - foto 4",
      "proporcao": "3:4"
    },
    {
      "arquivo": "xuxinhas-coloridas-5.webp",
      "alt": "Xuxinhas coloridas - foto 5",
      "proporcao": "3:4"
    },
    {
      "arquivo": "xuxinhas-coloridas-6.webp",
      "alt": "Xuxinhas coloridas - foto 6",
      "proporcao": "3:4"
    }
  ],
  "badges": [
    "ultimas-unidades"
  ],
  "tags": [
    "xuxinha"
  ],
  "status": "publicado",
  "seoDescricao": "Xuxinhas coloridas feitas com retalhos de tecido da Turkista. As cores e estampas variam conforme os materiais disponíveis, tornando cada peça única. R$ 10.",
  "dataCriacao": "2026-08-18",
  "genero": "feminino",
  "faixaEtaria": "15+"
}
