{
  "id": "prod_maiodesu",
  "slug": "maio-de-surf-flora",
  "nome": "Maiô de Surf Flora",
  "linha": "surf",
  "categoria": "maiô",
  "descricaoCurta": "Maiô de surf Flora com estampa floral multicolorida, detalhes amarelos nos ombros e mangas e punhos pretos. Modelagem ajustada e malha de secagem rápida.",
  "descricaoCompleta": "A parte frontal e traseira recebe a estampa floral, complementada por detalhes em amarelo nos ombros e mangas e acabamento preto nos punhos. A modelagem acompanha o corpo, proporcionando conforto e liberdade de movimento para a prática de surf e outras atividades na água.\r\n\r\nConfeccionado em malha de fácil secagem, é uma opção prática para quem busca uma peça funcional para a praia e esportes aquáticos.\r\n\r\nO modelo possui fechamento na parte inferior, entre as pernas, facilitando o vestir e retirar a peça e trazendo mais praticidade durante o uso.\r\n\r\nDestaques da peça:\r\n\r\nMalha de fácil secagem\r\nManga longa\r\nEstampa floral colorida\r\nDetalhes em amarelo e preto\r\nModelagem ajustada ao corpo\r\nLiberdade de movimento\r\nFechamento entre as pernas\r\nIdeal para surf, praia e atividades aquáticas",
  "composicao": {
    "tecido": "Poliamida (84% a 85%) e elastano (15% a 16%)",
    "protecaoUV": null,
    "paisDeFabricacao": "Brasil"
  },
  "cores": [
    {
      "nome": "colorido",
      "hex": "#F279C8",
      "imagens": [
        {
          "arquivo": "maio-de-surf-flora-1.webp",
          "alt": "Maiô de Surf Flora",
          "proporcao": "3:4"
        },
        {
          "arquivo": "maio-de-surf-flora-2.webp",
          "alt": "Maiô de Surf Flora",
          "proporcao": "3:4"
        }
      ]
    }
  ],
  "tamanhos": [
    "M"
  ],
  "preco": {
    "valor": 650,
    "parcelamento": "5x sem juros"
  },
  "imagens": [
    {
      "arquivo": "maio-de-surf-flora-1.webp",
      "alt": "Maiô de Surf Flora",
      "proporcao": "3:4"
    },
    {
      "arquivo": "maio-de-surf-flora-2.webp",
      "alt": "Maiô de Surf Flora",
      "proporcao": "3:4"
    }
  ],
  "badges": [
    "exclusivo",
    "ultimas-unidades"
  ],
  "tags": [
    "maiô de surf",
    "surf",
    "maiô colorido"
  ],
  "status": "publicado",
  "dataCriacao": "2026-08-14",
  "genero": "feminino",
  "faixaEtaria": "15+",
  "seoDescricao": "Maiô de surf Flora com estampa floral colorida e mangas com detalhes amarelos. Tamanho M, por R$ 650 em 5x sem juros."
}
